{
  "checks": {
    "agent-surface": {
      "detail": "repo-local skill surface",
      "evidence": {
        "digest": "sha256:dd62a14b4a1f948c6745a6717222df084bc26445b25a76510bfadf1b5fd101c6",
        "path": ".agents/skills"
      },
      "status": "pass"
    },
    "baseline-dir:docs/design-docs": {
      "detail": "required directory",
      "evidence": {
        "digest": "sha256:884ef7e8f334e4606414bdd1f2736583aa3fe338e7934681699ddee56f3b6e59",
        "path": "docs/design-docs"
      },
      "status": "pass"
    },
    "baseline-dir:docs/exec-plans/active": {
      "detail": "required directory",
      "evidence": {
        "digest": "sha256:dd62a14b4a1f948c6745a6717222df084bc26445b25a76510bfadf1b5fd101c6",
        "path": "docs/exec-plans/active"
      },
      "status": "pass"
    },
    "baseline-dir:docs/exec-plans/completed": {
      "detail": "required directory",
      "evidence": {
        "digest": "sha256:dd62a14b4a1f948c6745a6717222df084bc26445b25a76510bfadf1b5fd101c6",
        "path": "docs/exec-plans/completed"
      },
      "status": "pass"
    },
    "baseline-dir:docs/generated": {
      "detail": "required directory",
      "evidence": {
        "digest": "sha256:a48746cae70c44e7e105b594aad338ddd105c93c1cb445a40ba6aab785ba69e5",
        "path": "docs/generated"
      },
      "status": "pass"
    },
    "baseline-dir:docs/product-specs": {
      "detail": "required directory",
      "evidence": {
        "digest": "sha256:a48746cae70c44e7e105b594aad338ddd105c93c1cb445a40ba6aab785ba69e5",
        "path": "docs/product-specs"
      },
      "status": "pass"
    },
    "baseline-dir:docs/references": {
      "detail": "required directory",
      "evidence": {
        "digest": "sha256:a48746cae70c44e7e105b594aad338ddd105c93c1cb445a40ba6aab785ba69e5",
        "path": "docs/references"
      },
      "status": "pass"
    },
    "baseline-dir:validation_artifacts": {
      "detail": "required directory",
      "evidence": {
        "digest": "sha256:38e9a77f0d550e248ac88f3a45ab0472a6de98cbd452b802dcd4c0893ce99b54",
        "path": "validation_artifacts"
      },
      "status": "pass"
    },
    "baseline-file:.codex/environments/environment.toml": {
      "detail": "present and non-placeholder",
      "evidence": {
        "digest": "sha256:8aed16229fa3cab52b8c177f8b39a9516d609dec0906bb746ba54d529bf358c3",
        "path": ".codex/environments/environment.toml"
      },
      "status": "pass"
    },
    "baseline-file:.codex/setup-worktree-env.sh": {
      "detail": "present and non-placeholder",
      "evidence": {
        "digest": "sha256:953a699f966147e1f16870a353659e463b934f49fef7c5374ab7645d511e92e3",
        "path": ".codex/setup-worktree-env.sh"
      },
      "status": "pass"
    },
    "baseline-file:.gitignore": {
      "detail": "present and non-placeholder",
      "evidence": {
        "digest": "sha256:0a00eebba7d3d181e265b668295abd8b988b387d7c85b5879a435333cf2164eb",
        "path": ".gitignore"
      },
      "status": "pass"
    },
    "baseline-file:.harness/coverage-command": {
      "detail": "present and non-placeholder",
      "evidence": {
        "digest": "sha256:473f36acbadf7d8a76db5d3da5563f40382465b26f76193d0a8fbf1cd1193428",
        "path": ".harness/coverage-command"
      },
      "status": "pass"
    },
    "baseline-file:.harness/coverage-manifest.json": {
      "detail": "present and non-placeholder",
      "evidence": {
        "digest": "sha256:62e93190a56859bc45d2960c405ce17811a5929b0e62ef48380f58cde7ada39c",
        "path": ".harness/coverage-manifest.json"
      },
      "status": "pass"
    },
    "baseline-file:AGENTS.md": {
      "detail": "present and non-placeholder",
      "evidence": {
        "digest": "sha256:8649143b4e3d7b6bebde3a14a3b6ff9237b251d743c3e6d66e26dc703c7ff0cf",
        "path": "AGENTS.md"
      },
      "status": "pass"
    },
    "baseline-file:AGENT_STANDARDS.md": {
      "detail": "present and non-placeholder",
      "evidence": {
        "digest": "sha256:a26d00cee88ec7b6f011a3c1505a2be698a4709ad0aad3dc1a63110eb752da06",
        "path": "AGENT_STANDARDS.md"
      },
      "status": "pass"
    },
    "baseline-file:ARCHITECTURE.md": {
      "detail": "present and non-placeholder",
      "evidence": {
        "digest": "sha256:26825a5e0854d0e2855910bfaab3c828ca5233a697ccad30d8e4dbf0b37978e5",
        "path": "ARCHITECTURE.md"
      },
      "status": "pass"
    },
    "baseline-file:COVERAGE_RECEIPT.json": {
      "detail": "present and non-placeholder",
      "evidence": {
        "digest": "sha256:af3816c4ffb75c9351c17279d4e83960398262e6261d9ffc43469da42777fd9c",
        "path": "COVERAGE_RECEIPT.json"
      },
      "status": "pass"
    },
    "baseline-file:DESIGN.md": {
      "detail": "present and non-placeholder",
      "evidence": {
        "digest": "sha256:6f33d7cffa98f5172691bf8dfee616c90ce9885f2e836c4a5c1ca7915b852209",
        "path": "DESIGN.md"
      },
      "status": "pass"
    },
    "baseline-file:FRONTEND.md": {
      "detail": "present and non-placeholder",
      "evidence": {
        "digest": "sha256:ca4e72947e8264fdb48ee5ed297c7c771fe58f99c64516decee2d48eb9a58cd3",
        "path": "FRONTEND.md"
      },
      "status": "pass"
    },
    "baseline-file:PLANS.md": {
      "detail": "present and non-placeholder",
      "evidence": {
        "digest": "sha256:863c4ef461efc461de3bae4b28566ca76780c23b01d3c19951b00e5d6b160eeb",
        "path": "PLANS.md"
      },
      "status": "pass"
    },
    "baseline-file:PRODUCT_SENSE.md": {
      "detail": "present and non-placeholder",
      "evidence": {
        "digest": "sha256:de8617e548e40a01a274a4a0881c5be43e5d4ee77585280c07d1245bd66879ee",
        "path": "PRODUCT_SENSE.md"
      },
      "status": "pass"
    },
    "baseline-file:QUALITY_SCORE.md": {
      "detail": "present and non-placeholder",
      "evidence": {
        "digest": "sha256:83a7ce3fe371d13395628ca02e17e9a405918ec7081975959920a6ebf27c3629",
        "path": "QUALITY_SCORE.md"
      },
      "status": "pass"
    },
    "baseline-file:RELIABILITY.md": {
      "detail": "present and non-placeholder",
      "evidence": {
        "digest": "sha256:a7b61e57073021810aa0e89571bab1720d0d03df5b3c7400ea167180a890a8e3",
        "path": "RELIABILITY.md"
      },
      "status": "pass"
    },
    "baseline-file:SECURITY.md": {
      "detail": "present and non-placeholder",
      "evidence": {
        "digest": "sha256:be99f7d047d24dcc3ed036ea6242d68d6dc84a08149a24100287103709e668dc",
        "path": "SECURITY.md"
      },
      "status": "pass"
    },
    "baseline-file:agent-standards/enforcement-audit.tsv": {
      "detail": "present and non-placeholder",
      "evidence": {
        "digest": "sha256:f3429e0ffe3b247ad4af88ed8f0b6db1958ee6e6f236d3076f7c97791fe89802",
        "path": "agent-standards/enforcement-audit.tsv"
      },
      "status": "pass"
    },
    "baseline-file:agent-standards/enforcement.json": {
      "detail": "present and non-placeholder",
      "evidence": {
        "digest": "sha256:d971c8ad47749d6427cc3e21517bb9bba7a6070118fe5a33eb1f87c355d358bf",
        "path": "agent-standards/enforcement.json"
      },
      "status": "pass"
    },
    "baseline-file:agent-standards/enforcement.tsv": {
      "detail": "present and non-placeholder",
      "evidence": {
        "digest": "sha256:dd82de675c5ab143424f8353cf701e187209e51a75b4895b1f439faad0b45b76",
        "path": "agent-standards/enforcement.tsv"
      },
      "status": "pass"
    },
    "baseline-file:docs/design-docs/core-beliefs.md": {
      "detail": "present and non-placeholder",
      "evidence": {
        "digest": "sha256:a49b839168ba8322fdb9d4184dcc5e26fe562d4a1a0717e75a829aa9db7f28be",
        "path": "docs/design-docs/core-beliefs.md"
      },
      "status": "pass"
    },
    "baseline-file:docs/design-docs/index.md": {
      "detail": "present and non-placeholder",
      "evidence": {
        "digest": "sha256:af75357bf19d8eadee1133322e2ff84e0f92abadd07521cf3956a6810c87a3f7",
        "path": "docs/design-docs/index.md"
      },
      "status": "pass"
    },
    "baseline-file:docs/exec-plans/tech-debt-tracker.md": {
      "detail": "present and non-placeholder",
      "evidence": {
        "digest": "sha256:8def6d3a957a865673151179e89a43cec4042540318cad8855661de5489258b8",
        "path": "docs/exec-plans/tech-debt-tracker.md"
      },
      "status": "pass"
    },
    "baseline-file:docs/generated/index.md": {
      "detail": "present and non-placeholder",
      "evidence": {
        "digest": "sha256:5a8ad3a1fd5eb1c8d3fe14eea3529acdede26517663a55d7bcd1b28682c3ad8f",
        "path": "docs/generated/index.md"
      },
      "status": "pass"
    },
    "baseline-file:docs/plugin-cohesion-manifest.json": {
      "detail": "present and non-placeholder",
      "evidence": {
        "digest": "sha256:9352033da4df865077cb0774f9c532e312dc796f04f8439ef7540bcbdecc345c",
        "path": "docs/plugin-cohesion-manifest.json"
      },
      "status": "pass"
    },
    "baseline-file:docs/product-specs/index.md": {
      "detail": "present and non-placeholder",
      "evidence": {
        "digest": "sha256:fa593ae9db6d82e13f5d8074fd7eb21cebd7ca7c33843739144b6a1a4c97a764",
        "path": "docs/product-specs/index.md"
      },
      "status": "pass"
    },
    "baseline-file:docs/references/index.md": {
      "detail": "present and non-placeholder",
      "evidence": {
        "digest": "sha256:f79ae725419c8580deade80a46f242307e0bafda8bc97132885a7e68d72c6677",
        "path": "docs/references/index.md"
      },
      "status": "pass"
    },
    "baseline-file:scripts/check-agent-standards": {
      "detail": "present and non-placeholder",
      "evidence": {
        "digest": "sha256:8c3993ba47f50f70e62116a486158eeb353c269800b589948c75cb73d6a960ff",
        "path": "scripts/check-agent-standards"
      },
      "status": "pass"
    },
    "baseline-file:scripts/check-coverage-fast": {
      "detail": "present and non-placeholder",